{
  "$schema": "http://json-schema.org/draft-07/schema#",
  "title": "MP3DU SimulationConfig",
  "type": "object",
  "required": [
    "velocity_method",
    "solver",
    "adaptive",
    "dispersion",
    "retardation_enabled",
    "capture",
    "initial_dt",
    "max_dt",
    "direction"
  ],
  "properties": {
    "velocity_method": {
      "type": "string",
      "enum": ["Waterloo"],
      "description": "Velocity-method selector used by the SimulationConfig schema. Currently only `Waterloo` is accepted here. SSP&A workflows still use `Waterloo` in the config because the SSP&A velocity field is fitted outside the JSON config and then tracked through the same runtime interface."
    },
    "solver": {
      "type": "string",
      "enum": [
        "Euler",
        "Rk4StepDoubling",
        "DormandPrince",
        "CashKarp",
        "VernerRobust",
        "VernerEfficient"
      ]
    },
    "adaptive": {
      "type": "object",
      "required": [
        "tolerance",
        "safety",
        "alpha",
        "min_scale",
        "max_scale",
        "max_rejects",
        "min_dt",
        "euler_dt"
      ],
      "properties": {
        "tolerance": { "type": "number", "exclusiveMinimum": 0 },
        "safety": { "type": "number", "exclusiveMinimum": 0 },
        "alpha": { "type": "number", "exclusiveMinimum": 0 },
        "min_scale": { "type": "number", "exclusiveMinimum": 0 },
        "max_scale": { "type": "number", "exclusiveMinimum": 0 },
        "max_rejects": { "type": "integer", "minimum": 0 },
        "min_dt": { "type": "number", "exclusiveMinimum": 0 },
        "euler_dt": { "type": "number", "exclusiveMinimum": 0 }
      },
      "additionalProperties": false
    },
    "dispersion": {
      "oneOf": [
        {
          "type": "object",
          "required": ["method"],
          "properties": {
            "method": { "const": "None" }
          },
          "additionalProperties": false
        },
        {
          "type": "object",
          "required": ["method", "alpha_l", "alpha_th", "alpha_tv"],
          "properties": {
            "method": { "const": "Gsde" },
            "alpha_l": { "type": "number", "minimum": 0 },
            "alpha_th": { "type": "number", "minimum": 0 },
            "alpha_tv": { "type": "number", "minimum": 0 }
          },
          "additionalProperties": false
        },
        {
          "type": "object",
          "required": ["method", "alpha_l", "alpha_th", "alpha_tv"],
          "properties": {
            "method": { "const": "Ito" },
            "alpha_l": { "type": "number", "minimum": 0 },
            "alpha_th": { "type": "number", "minimum": 0 },
            "alpha_tv": { "type": "number", "minimum": 0 }
          },
          "additionalProperties": false
        }
      ]
    },
    "retardation_enabled": {
      "type": "boolean"
    },
    "capture": {
      "type": "object",
      "required": [
        "max_time",
        "max_steps",
        "stagnation_velocity",
        "stagnation_limit"
      ],
      "properties": {
        "max_time": {
          "type": "number",
          "exclusiveMinimum": 0,
          "description": "Maximum cumulative tracking time for one particle, in the model's time units (for example days or seconds). The particle terminates once its accumulated travel time reaches or exceeds this value."
        },
        "max_steps": {
          "type": "integer",
          "minimum": 1,
          "description": "Maximum number of accepted integration steps for one particle. This is unitless and acts as a safety cap on solver work even if the particle has not yet been captured or reached max_time."
        },
        "stagnation_velocity": {
          "type": "number",
          "minimum": 0,
          "description": "Velocity-magnitude threshold used for stagnation detection, in model length per model time (for example m/day or ft/s). A step is counted as stagnant when the particle velocity magnitude is below this value."
        },
        "stagnation_limit": {
          "type": "integer",
          "minimum": 1,
          "description": "Number of consecutive stagnant accepted steps required before termination. If velocity rises back above stagnation_velocity, the stagnation counter resets to zero."
        },
        "capture_radius": {
          "type": "number",
          "exclusiveMinimum": 0,
          "description": "Distance from the well centre (cell centre) used for internal-well capture. A particle is terminated only after it gets within this radius of the centre. Smaller values delay capture until the particle is very near the centre; larger values make capture occur sooner after entering the well cell."
        },
        "face_epsilon": {
          "type": "number",
          "exclusiveMinimum": 0,
          "default": 1e-6,
          "description": "Tolerance for top/bottom face proximity checks during IFACE-based capture. Particle is considered at the face when z > 1 - face_epsilon (top) or z < face_epsilon (bottom). Increase only if particles leak through top/bottom capture faces; decrease only if they are being captured too far from the face. Default: 1e-6."
        }
      },
      "additionalProperties": false
    },
    "initial_dt": { "type": "number", "exclusiveMinimum": 0 },
    "max_dt": { "type": "number", "exclusiveMinimum": 0 },
    "direction": { "type": "number", "enum": [1.0, -1.0] }
  },
  "additionalProperties": false
}
